"TCWSFYQC","bookSection","2021","Preminger, Jonathan","Moral Community as a Yardstick for Alternative Organizations: Evaluating Employee Ownership and its Place within the Socioeconomic Order","Organizational Imaginaries: Tempering Capitalism and Tending to Communities through Cooperatives and Collectivist Democracy","978-1-83867-989-7 978-1-83867-990-3","","","https://doi.org/10.1108/S0733-558X20210000072004","Following critiques of shareholder capitalism and calls for reform of the corporation, employee-owned firms have attracted public and government attention in the UK and elsewhere, based on the view that these alternative organizations serve a broader public purpose. However, despite attempts to broaden the measures for evaluating organizations and take seriously the social effects of business decisions, we lack a holistic framework for evaluating this public purpose that addresses aspirations like participation, democracy, equality, solidarity, and strong community relations alongside financial resilience and profitability. This study proposes that a solution can be found in Selznick’s concept of “moral community.” Selznick argued that community, conceived as a response to the perceived unravelling of the social fabric, plays a vital role in countering the excesses of capitalism. Using this as a yardstick to evaluate employee ownership (EO) in the UK, the author argues that the EO organizational field is indeed an embodiment of a moral community. It successfully infuses a broad range of social values into economic pursuits, nurtures an inclusive sense of the “common good,” and mitigates the alienation resulting from an increasingly marketized society. At the same time, the EO moral community does not reject capitalism as such, aspiring to connect with and reform existing political, financial, and legal structures as opposed to positioning its own institutions as an alternative to them. There are, therefore, limits to the challenge that the EO community levels against the current socioeconomic order.","2021-01-01","2023-11-22 21:44:07","2023-11-22 21:44:07","2023-11-22 21:44:07","83-112","","","72","","","Moral Community as a Yardstick for Alternative Organizations","Research in the Sociology of Organizations","","","","Emerald Publishing Limited","","","","","","","Emerald Insight","","DOI: 10.1108/S0733-558X20210000072004","","C:\Users\DELL\Zotero\storage\NNEM8ETM\html.html","","","Alternative organizations; Capitalism; Collectivist-democratic organizations; Communitarianism; Community; Employee ownership","K. Chen, Katherine; Tan Chen, Victor","","","","","","","","","","","","","","","","","","","","","","","","","","","","","","","","","","","","","","","","","","","","",""
"8HFFENB9","journalArticle","2021","Nik Abdul Ghani, Nik Abdul Rahim; Salleh, Ahmad Dahlan; Jusoh @ Yusoff, Amir Fazlim; Mat Zain, Mat Noor; Yaacob, Salmy Edawati; Ahmad, Azlin Alisa; Saleem, Muhammad Yusuf","Critical analysis of beneficial ownership in mushārakah based home financing in Malaysia","Qualitative Research in Financial Markets","","1755-4179","10.1108/QRFM-01-2020-0003","https://doi.org/10.1108/QRFM-01-2020-0003","Purpose This paper critically aims to examine the concept of beneficial ownership and its application in musharakah-based home financing. Design/methodology/approach The study applies the method of juristic interpretation in analyzing the meaning of beneficial ownership in legal documentation of musharakah-based home financing. This qualitative study uses content analysis approach that investigates the works of Islamic scholars on the concept of ownership and evaluates the concept of beneficial ownership in musharakah-based home financing from the Islamic perspective. Findings The result finds that beneficial ownership is considered a true ownership, as Shari’ah allows the transfer of ownership based on the offer and acceptance in a contract. Furthermore, the absence of legal registration does not mean the absence of true ownership, whereas all documentations and agreements have clearly stated rights and liabilities of each contracting parties. Originality/value This paper provides a fiqhi discussion of analyzing beneficial ownership in musharakah-based home financing. It shows that Shari’ah parameters are essential for the use of beneficial ownership to ensure its compliance with the Shari’ah requirements of milkiyyah (ownership).","2021-01-01","2023-11-22 21:47:35","2023-11-22 21:47:35","2023-11-22 21:47:32","161-182","","2","13","","","","","","","","","","","","","","","Emerald Insight","","Publisher: Emerald Publishing Limited","","C:\Users\DELL\Zotero\storage\C8GHJGI5\html.html","","","Ownership; Beneficial; Home financing; Islamic finance; Musharakah","","","","","","","","","","","","","","","","","","","","","","","","","","","","","","","","","","","","","","","","","","","","","",""
"2XNUZK2L","bookSection","2004","Kalmi, Panu","EXCLUSION FROM EMPLOYEE OWNERSHIP: EVIDENCE FROM ESTONIAN CASE STUDIES","Employee Participation, Firm Performance and Survival","978-0-7623-1114-9 978-1-84950-277-1","","","https://doi.org/10.1016/S0885-3339(04)08002-0","One of the surprising developments in the privatization processes of post-socialist economies was the high incidence of employee ownership. However, the available evidence suggests that the number of employee-owned firms is declining quite rapidly. This paper approaches the decline by using data on individuals in Estonian employee-owned firms. The key idea is that employee ownership can be sustainable only if it is extended also to new, incoming employees.We analyze the determinants of ownership in employee-owned firms and find out that new employees are excluded from ownership. While this finding is consistent with the literature on “degeneration” of employee-owned firms, it is not consistent with earlier empirical research. We argue that in developed economies, there are many countervailing forces that prevent the decline, but these are not in operation in Estonia. The peculiarity of Estonian findings is explained by different motives of entry of employee ownership vs. advanced market economies. However, the findings from this study may carry over to other transition economies as well.","2004-01-01","2023-11-22 21:47:35","2023-11-22 21:47:35","2023-11-22 21:47:33","35-65","","","8","","","EXCLUSION FROM EMPLOYEE OWNERSHIP","Advances in the Economic Analysis of Participatory & Labor-Managed Firms","","","","Emerald Group Publishing Limited","","","","","","","Emerald Insight","","DOI: 10.1016/S0885-3339(04)08002-0","","C:\Users\DELL\Zotero\storage\T9NDJKQT\html.html","","","","Perotin, Virginie; Robinson, Andrew","","","","","","","","","","","","","","","","","","","","","","","","","","","","","","","","","","","","","","","","","","","","",""
"27ZX7M57","journalArticle","2021","Al Amosh, Hamzeh; Khatib, Saleh F.A.","Ownership structure and environmental, social and governance performance disclosure: the moderating role of the board independence","Journal of Business and Socio-economic Development","","2635-1692","10.1108/JBSED-07-2021-0094","https://doi.org/10.1108/JBSED-07-2021-0094","Purpose The current study dealt with the ownership structure effect as a potential determinant of the environmental, social and governance (ESG) performance disclosure in the Jordanian context. Design/methodology/approach Using the content analysis technique, data were collected and analyzed from a final sample of 51 annual reports of Jordanian industrial companies listed for 2012–2019. Findings The results show that foreign ownership and state ownership play a critical role in disclosing the ESG performance. Also, the board's independence plays an influential role in improving disclosure quality, enhancing family ownership in disclosure. It also limits the negative role of block holder ownership and managerial ownership on the ESG disclosure. Originality/value To the best of the authors' knowledge, this is the first study that deals with the role of ownership structure on the ESG disclosure level separately and collectively through the moderating role of board independence.","2021-01-01","2023-11-22 21:47:35","2023-11-22 21:47:35","2023-11-22 21:47:34","49-66","","1","2","","","Ownership structure and environmental, social and governance performance disclosure","","","","","","","","","","","","Emerald Insight","","Publisher: Emerald Publishing Limited","","C:\Users\DELL\Zotero\storage\LPZXCFKS\Al Amosh and Khatib - 2021 - Ownership structure and environmental, social and .pdf","","","Board independence; ESG disclosure; Legitimacy; Ownership structure; Stakeholders","","","","","","","","","","","","","","","","","","","","","","","","","","","","","","","","","","","","","","","","","","","","","",""
"HC65TW8Z","journalArticle","2006","Jahmani, Yousef; Ansari, Mohammed","Managerial ownership, risk, and corporate performance","International Journal of Commerce and Management","","1056-9219","10.1108/10569210680000209","https://doi.org/10.1108/10569210680000209","This study examines the impact of managerial ownership on risk‐taking and firm performance. The study utilizes data for thirty randomly selected companies from four industries in four different sectors. Industries are oil & gas and field services from energy sector; insurance, property, and casualty from the financial sector, drugs from the health sector; and computer and data processing from the technology sector. This yielded a total of 120 observations. Accounting measures and correlation analysis are used to determine the relationship between managerial ownership, risk‐taking, and firm performance in each industry and for the whole sample. We found no significant relationship between these variables in different industries and for the whole sample. Managerial ownership seems to be merely a reflection of the way in which managers receive their benefits. Managerial ownership does not seem to provide any incentive to work harder for improving the company’s performance in the accounting sense.","2006-01-01","2023-11-22 21:47:35","2023-11-22 21:47:35","2023-11-22 21:47:35","86-94","","2","16","","","","","","","","","","","","","","","Emerald Insight","","Publisher: Emerald Group Publishing Limited","","C:\Users\DELL\Zotero\storage\8T75LY5L\html.html","","","Corporate ownership; Organizational performance; Risk management","","","","","","","","","","","","","","","","","","","","","","","","","","","","","","","","","","","","","","","","","","","","","",""
"6IDCS3IS","journalArticle","1996","Philpotts, Mike","An introduction to the concepts, benefits and terminology of product data management","Industrial Management & Data Systems","","0263-5577","10.1108/02635579610117467","https://doi.org/10.1108/02635579610117467","Product data management (PDM) systems help to keep track of the masses of information needed to design, manufacture or build products and then to maintain them. They can be applied to a wide range of products and industries and across the whole spectrum of organizational functions. Benefits extend far beyond engineering design to include cost savings in manufacturing, reduced time to market and increased product quality. Defines and describes the type of features and functions that should be found in a PDM system and addresses the following: data vault and document management; workflow and process management; product structure management; classification; project management; communication and notification; data transport and translation; image services; system administration; and PDM environments.","1996-01-01","2023-11-22 21:50:28","2023-11-22 21:50:28","2023-11-22 21:50:16","11-17","","4","96","","","","","","","","","","","","","","","Emerald Insight","","Publisher: MCB UP Ltd","","C:\Users\DELL\Zotero\storage\AGB9A2HV\html.html","","","Database management; Databases; Process management; Product information; Product lifecycle","","","","","","","","","","","","","","","","","","","","","","","","","","","","","","","","","","","","","","","","","","","","","",""
"NZ9WFIK5","journalArticle","2018","Brous, Paul; Janssen, Marijn; Herder, Paulien","Internet of Things adoption for reconfiguring decision-making processes in asset management","Business Process Management Journal","","1463-7154","10.1108/BPMJ-11-2017-0328","https://doi.org/10.1108/BPMJ-11-2017-0328","Purpose Managers are increasingly looking to adopt the Internet of Things (IoT) to include the vast amount of big data generated in their decision-making processes. The use of IoT might yield many benefits for organizations engaged in civil infrastructure management, but these benefits might be difficult to realize as organizations are not equipped to handle and interpret this data. The purpose of this paper is to understand how IoT adoption affects decision-making processes. Design/methodology/approach In this paper the changes in the business processes for managing civil infrastructure assets brought about by IoT adoption are analyzed by investigating two case studies within the water management domain. Propositions for effective IoT adoption in decision-making processes are derived. Findings The results show that decision processes in civil infrastructure asset management have been transformed to deal with the real-time nature of the data. The authors found the need to make organizational and business process changes, development of new capabilities, data provenance and governance and the need for standardization. IoT can have a transformative effect on business processes. Research limitations/implications Because of the chosen research approach, the research results may lack generalizability. Therefore, researchers are encouraged to test the propositions further. Practical implications The paper shows that data provenance is necessary to be able to understand the value and the quality of the data often generated by various organizations. Managers need to adapt new capabilities to be able to interpret the data. Originality/value This paper fulfills an identified need to understand how IoT adoption affects decision-making processes in asset management in order to be able to achieve expected benefits and mitigate risk.","2018-01-01","2023-11-22 21:50:28","2023-11-22 21:50:28","2023-11-22 21:50:18","495-511","","3","25","","","","","","","","","","","","","","","Emerald Insight","","Publisher: Emerald Publishing Limited","","C:\Users\DELL\Zotero\storage\6L3SB6ZQ\Brous et al. - 2018 - Internet of Things adoption for reconfiguring deci.pdf","","","Adoption; Asset management; Business process; Internet of Things; IoT","","","","","","","","","","","","","","","","","","","","","","","","","","","","","","","","","","","","","","","","","","","","","",""
"D7ZTRQ3R","journalArticle","2019","Razmi-Farooji, Arian; Kropsu-Vehkaperä, Hanna; Härkönen, Janne; Haapasalo, Harri","Advantages and potential challenges of data management in e-maintenance","Journal of Quality in Maintenance Engineering","","1355-2511","10.1108/JQME-03-2018-0018","https://doi.org/10.1108/JQME-03-2018-0018","Purpose The purpose of this paper is twofold: first, to understand data management challenges in e-maintenance systems from a holistically viewpoint through summarizing the earlier scattered research in the field, and second, to present a conceptual approach for addressing these challenges in practice. Design/methodology/approach The study is realized as a combination of a literature review and by the means of analyzing the practices on an industry leader in manufacturing and maintenance services. Findings This research provides a general understanding over data management challenges in e-maintenance and summarizes their associated proposed solutions. In addition, this paper lists and exemplifies different types and sources of data which can be collected in e-maintenance, across different organizational levels. Analyzing the data management practices of an e-maintenance industry leader provides a conceptual approach to address identified challenges in practice. Research limitations/implications Since this paper is based on studying the practices of a single company, it might be limited to generalize the results. Future research topics can focus on each of mentioned data management challenges and also validate the applicability of presented model in other companies and industries. Practical implications Understanding the e-maintenance-related challenges helps maintenance managers and other involved stakeholders in e-maintenance systems to better solve the challenges. Originality/value The so-far literature on e-maintenance has been studied with narrow focus to data and data management in e-maintenance appears as one of the less studied topics in the literature. This research paper contributes to e-maintenance by highlighting the deficiencies of the discussion surrounding the perspectives of data management in e-maintenance by studying all common data management challenges and listing different types of data which need to be acquired in e-maintenance systems.","2019-01-01","2023-11-22 21:50:28","2023-11-22 21:50:28","2023-11-22 21:50:19","378-396","","3","25","","","","","","","","","","","","","","","Emerald Insight","","Publisher: Emerald Publishing Limited","","C:\Users\DELL\Zotero\storage\2S8DSGAN\html.html","","","Data acquisition; Data combination; Data management; Data quality; E-maintenance; Maintenance data","","","","","","","","","","","","","","","","","","","","","","","","","","","","","","","","","","","","","","","","","","","","","",""
"A4NXWBIB","journalArticle","2022","Franke, Franziska; Hiebl, Martin R.W.","Big data and decision quality: the role of management accountants’ data analytics skills","International Journal of Accounting & Information Management","","1834-7649","10.1108/IJAIM-12-2021-0246","https://doi.org/10.1108/IJAIM-12-2021-0246","Purpose Existing research on the relationship between big data and organizational decision quality is still few and far between, and what does exist often assumes direct effects of big data on decision quality. More recent research indicates that such direct effects may be too simplistic, and in particular, an organization’s overall human skills are often not considered sufficiently. Inspired by the knowledge-based view, we therefore propose that interactions between three aspects of big data usage and management accountants’ data analytics skills may be key to reaching high-quality decisions. The purpose of this study is to test these predictions based on a survey of US firms. Design/methodology/approach The authors draw on survey data from 140 US firms. This survey has been conducted via MTurk in 2020. Findings The results of the study show that the quality of big data sources is associated with higher perceived levels of decision quality. However, according to the results, the breadth of big data sources and a data-driven culture only improve decision quality if management accountants’ data analytics skills are highly developed. These results point to the important, but so far unexamined role of an organization’s management accountants and their skills for translating big data into high-quality decisions. Practical implications The present study highlights the importance of an organization’s human skills in creating value out of big data. In particular, the findings imply that management accountants may need to increasingly draw on data analytics skills to make the most out of big data for their employers. Originality/value This study is among the first, to the best of the authors’ knowledge, to provide empirical proof of the relevance of an organization’s management accountants and their data analytics skills for reaching desirable firm-level outcomes. In addition, this study thus adds to the further advancement of the knowledge-based view by providing evidence that in contemporary big-data environments, interactions between tacit and explicit knowledge seem crucial for driving desirable firm-level outcomes.","2022-01-01","2023-11-22 21:50:28","2023-11-22 21:50:28","2023-11-22 21:50:25","93-127","","1","31","","","Big data and decision quality","","","","","","","","","","","","Emerald Insight","","Publisher: Emerald Publishing Limited","","C:\Users\DELL\Zotero\storage\KR4EEPE2\html.html","","","Big data; Decision quality; Knowledge-based view; Management accountants; Management accounting","","","","","","","","","","","","","","","","","","","","","","","","","","","","","","","","","","","","","","","","","","","","","",""
"2P7IBLCC","journalArticle","2022","Ledro, Cristina; Nosella, Anna; Vinelli, Andrea","Artificial intelligence in customer relationship management: literature review and future research directions","Journal of Business & Industrial Marketing","","0885-8624","10.1108/JBIM-07-2021-0332","https://doi.org/10.1108/JBIM-07-2021-0332","Purpose Due to the recent development of Big Data and artificial intelligence (AI) technology solutions in customer relationship management (CRM), this paper provides a systematic overview of the field, thus unveiling gaps and providing promising paths for future research. Design/methodology/approach A total of 212 peer-reviewed articles published between 1989 and 2020 were extracted from the Scopus database, and 2 bibliometric techniques were used: bibliographic coupling and keywords’ co-occurrence. Findings Outcomes of the bibliometric analysis enabled the authors to identify three main subfields of the AI literature within the CRM domain (Big Data and CRM as a database, AI and machine learning techniques applied to CRM activities and strategic management of AI–CRM integrations) and capture promising paths for future development for each of these subfields. This study also develops a three-step conceptual model for AI implementation in CRM, which can support, on one hand, scholars in further deepening the knowledge in this field and, on the other hand, managers in planning an appropriate and coherent strategy. Originality/value To the best of the authors’ knowledge, this study is the first to systematise and discuss the literature regarding the relationship between AI and CRM based on bibliometric analysis. Thus, both academics and practitioners can benefit from the study, as it unveils recent important directions in CRM management research and practices.","2022-01-01","2023-11-22 21:50:28","2023-11-22 21:50:28","2023-11-22 21:50:28","48-63","","13","37","","","Artificial intelligence in customer relationship management","","","","","","","","","","","","Emerald Insight","","Publisher: Emerald Publishing Limited","","C:\Users\DELL\Zotero\storage\5X5P7X8Z\Ledro et al. - 2022 - Artificial intelligence in customer relationship m.pdf","","","Big data; Artificial intelligence; Bibliometric analysis; Customer relationship management; Machine learning; Research agenda","","","","","","","","","","","","","","","","","","","","","","","","","","","","","","","","","","","","","","","","","","","","","",""
"T6NFERJK","journalArticle","2018","Warren, Matthew; Leitch, Shona","Data retention: an assessment of a proposed national scheme","Journal of Information, Communication and Ethics in Society","","1477-996X","10.1108/JICES-12-2017-0073","https://doi.org/10.1108/JICES-12-2017-0073","Purpose The information society has developed rapidly since the end of the twentieth century. Many countries (including Australia) have been looking at ways to protect their citizens against the variety of risks associated with the continued evolution of the internet. The Australian Federal Government in 2013 proposed data retention as one possible method of protecting Australian society and aiding law enforcement agencies to investigate and prosecute cyber-crime. Design/methodology/approach The aim of this paper is to consider the issue of data retention from a stakeholder’s perspective by analysing the public submissions garnered by the Australian Federal Government and identify the key issues and concerns that were raised by these stakeholders. The paper used a qualitative approach to undertake theme analysis. Findings The paper shows the concerns and wishes that different stakes holders have regarding data retention within Australia. Originality/value This is a unique study into implementation of data retention at a national level, in terms of the paper focussing on Australia.","2018-01-01","2023-11-22 21:53:17","2023-11-22 21:53:17","2023-11-22 21:53:13","98-112","","1","17","","","Data retention","","","","","","","","","","","","Emerald Insight","","Publisher: Emerald Publishing Limited","","C:\Users\DELL\Zotero\storage\QQUI6TU7\html.html","","","Australia; Data; Internet; Retention","","","","","","","","","","","","","","","","","","","","","","","","","","","","","","","","","","","","","","","","","","","","","",""
